[
  {
    "id": "herbal_pouch",
    "name": "草药袋",
    "description": "一个装满干燥草药的布袋，散发着淡淡的清香。",
    "icon": "🌿",
    "rarity": "common",
    "category": "consumable",
    "effects": [
      {
        "type": "hp_regen_bonus",
        "value": 1
      }
    ],
    "acquireText": "获得 🌿 草药袋 — 每年额外恢复1点HP"
  },
  {
    "id": "lucky_charm",
    "name": "幸运符",
    "description": "一块磨得发亮的小木牌，上面刻着古老的祝福符文。",
    "icon": "🍀",
    "rarity": "common",
    "category": "accessory",
    "effects": [
      {
        "type": "skill_check_bonus",
        "value": 0.05
      }
    ],
    "acquireText": "获得 🍀 幸运符 — 所有判定成功率+5%"
  },
  {
    "id": "old_map",
    "name": "古旧地图",
    "description": "泛黄的羊皮卷上标记着许多神秘的地点。",
    "icon": "🗺️",
    "rarity": "common",
    "category": "special",
    "effects": [
      {
        "type": "event_weight_bonus",
        "target": "explore",
        "value": 0.3
      }
    ],
    "acquireText": "获得 🗺️ 古旧地图 — 探索类事件权重+30%"
  },
  {
    "id": "traveler_cloak",
    "name": "旅人斗篷",
    "description": "一件经历了风雨的旧斗篷，穿上它就像有了一层保护。",
    "icon": "🧥",
    "rarity": "common",
    "category": "armor",
    "effects": [
      {
        "type": "damage_reduction",
        "value": 0.15
      }
    ],
    "acquireText": "获得 🧥 旅人斗篷 — 受到HP损失减少15%"
  },
  {
    "id": "training_dummy",
    "name": "练功桩",
    "description": "一具用硬木制成的训练假人，每天对着它练习能快速提升。",
    "icon": "🥊",
    "rarity": "common",
    "category": "weapon",
    "effects": [
      {
        "type": "attr_passive_growth",
        "target": "str",
        "value": 0.3
      }
    ],
    "acquireText": "获得 🥊 练功桩 — 体魄每年额外成长+0.3"
  },
  {
    "id": "crystal_shard",
    "name": "魔力碎片",
    "description": "一块散发着微弱蓝光的晶体碎片，握在手心能感受到魔力流动。",
    "icon": "💎",
    "rarity": "common",
    "category": "special",
    "effects": [
      {
        "type": "attr_passive_growth",
        "target": "mag",
        "value": 0.3
      }
    ],
    "acquireText": "获得 💎 魔力碎片 — 魔力每年额外成长+0.3"
  },
  {
    "id": "dragon_scale",
    "name": "龙鳞护符",
    "description": "一片闪着金属光泽的龙鳞，穿上线挂在脖子上，仿佛能感到巨龙的力量。",
    "icon": "🐲",
    "rarity": "rare",
    "category": "armor",
    "effects": [
      {
        "type": "damage_reduction",
        "value": 0.2
      },
      {
        "type": "attr_passive_growth",
        "target": "str",
        "value": 0.5
      }
    ],
    "acquireText": "获得 🐲 龙鳞护符 — 受到HP损失减少20%，体魄每年额外成长+0.5"
  },
  {
    "id": "fairy_dust",
    "name": "精灵之尘",
    "description": "一小瓶闪着七彩光芒的粉末，据说来自精灵族的花园。",
    "icon": "✨",
    "rarity": "rare",
    "category": "special",
    "effects": [
      {
        "type": "skill_check_bonus",
        "value": 0.08
      },
      {
        "type": "attr_passive_growth",
        "target": "chr",
        "value": 0.3
      }
    ],
    "acquireText": "获得 ✨ 精灵之尘 — 判定成功率+8%，魅力每年额外成长+0.3"
  },
  {
    "id": "cursed_blade",
    "name": "诅咒之刃",
    "description": "一把黑气缭绕的短剑。握住它的瞬间，你感到力量涌入身体，但代价是……",
    "icon": "🗡️",
    "rarity": "rare",
    "category": "weapon",
    "effects": [
      {
        "type": "attr_passive_growth",
        "target": "str",
        "value": 0.5
      },
      {
        "type": "hp_regen_bonus",
        "value": -1
      },
      {
        "type": "hp_cap_modifier",
        "value": -0.1
      }
    ],
    "acquireText": "获得 🗡️ 诅咒之刃 — 体魄成长+0.5/年，但HP恢复-1/年且HP上限降低10%"
  },
  {
    "id": "soul_gem",
    "name": "灵魂宝石",
    "description": "一颗温热的透明宝石，里面似乎封印着某种意志。灵魂越纯净，宝石越亮。",
    "icon": "🔮",
    "rarity": "rare",
    "category": "accessory",
    "effects": [
      {
        "type": "skill_check_bonus",
        "value": 0.1,
        "condition": "attribute.spr >= 30"
      },
      {
        "type": "conditional_regen",
        "value": 8,
        "condition": "hp < 30"
      }
    ],
    "acquireText": "获得 🔮 灵魂宝石 — 灵魂≥30时判定+10%，HP<30时恢复8点"
  },
  {
    "id": "merchant_ledger",
    "name": "商会账本",
    "description": "一位老商人临终前交给你的账本，里面记录着许多贸易秘密。",
    "icon": "📒",
    "rarity": "rare",
    "category": "special",
    "effects": [
      {
        "type": "attr_passive_growth",
        "target": "mny",
        "value": 0.5
      }
    ],
    "acquireText": "获得 📒 商会账本 — 家境每年额外成长+0.5"
  },
  {
    "id": "war_medal",
    "name": "军功章",
    "description": "一枚沉甸甸的铜质勋章，刻着王国的纹章。它是勇气与牺牲的证明。",
    "icon": "🎖️",
    "rarity": "rare",
    "category": "accessory",
    "effects": [
      {
        "type": "attr_passive_growth",
        "target": "str",
        "value": 0.3
      },
      {
        "type": "attr_passive_growth",
        "target": "chr",
        "value": 0.3
      }
    ],
    "acquireText": "获得 🎖️ 军功章 — 体魄和魅力每年额外成长+0.3"
  },
  {
    "id": "squire_shield",
    "name": "侍从之盾",
    "description": "一面轻巧的圆盾，上面刻着骑士团的徽记。它曾替你的主人挡下致命一击。",
    "icon": "🛡️",
    "rarity": "rare",
    "category": "armor",
    "effects": [
      {
        "type": "death_save",
        "value": 15
      }
    ],
    "acquireText": "获得 🛡️ 侍从之盾 — 免死一次（HP归零时恢复15点）"
  },
  {
    "id": "orphan_bracelet",
    "name": "孤儿手环",
    "description": "一条编织精美的手环，是教会修女亲手为你做的。每次握紧它，都感到温暖。",
    "icon": "📿",
    "rarity": "rare",
    "category": "accessory",
    "effects": [
      {
        "type": "conditional_regen",
        "value": 10,
        "condition": "hp < 25"
      },
      {
        "type": "hp_regen_bonus",
        "value": 0.5
      }
    ],
    "acquireText": "获得 📿 孤儿手环 — HP<25时恢复10点，每年额外恢复0.5HP"
  },
  {
    "id": "hero_blade",
    "name": "圣剑",
    "description": "传说中只有被选中的勇者才能举起的圣剑。它散发着温暖的金色光芒。",
    "icon": "⚔️",
    "rarity": "legendary",
    "category": "weapon",
    "effects": [
      {
        "type": "attr_passive_growth",
        "target": "str",
        "value": 0.5
      },
      {
        "type": "attr_passive_growth",
        "target": "chr",
        "value": 0.5
      },
      {
        "type": "hp_regen_bonus",
        "value": 2
      },
      {
        "type": "damage_reduction",
        "value": 0.15
      }
    ],
    "acquireText": "获得 ⚔️ 圣剑 — 体魄/魅力成长+0.5，HP恢复+2/年，伤害减免15%"
  },
  {
    "id": "world_seed",
    "name": "世界种子",
    "description": "一颗拳头大小的水晶球，内部是一个微缩的世界在缓缓转动。",
    "icon": "🌍",
    "rarity": "legendary",
    "category": "special",
    "effects": [
      {
        "type": "attr_passive_growth",
        "target": "mny",
        "value": 1
      },
      {
        "type": "attr_passive_growth",
        "target": "int",
        "value": 0.3
      },
      {
        "type": "event_weight_bonus",
        "target": "epic",
        "value": 0.5
      }
    ],
    "acquireText": "获得 🌍 世界种子 — 家境成长+1.0/年，智慧+0.3/年，史诗事件更容易触发"
  },
  {
    "id": "chronicle_book",
    "name": "编年史",
    "description": "一本自动书写的魔法书籍，记录着你的一生——也反过来塑造着你。",
    "icon": "📖",
    "rarity": "legendary",
    "category": "special",
    "effects": [
      {
        "type": "attr_passive_growth",
        "target": "str",
        "value": 0.2
      },
      {
        "type": "attr_passive_growth",
        "target": "int",
        "value": 0.2
      },
      {
        "type": "attr_passive_growth",
        "target": "chr",
        "value": 0.2
      },
      {
        "type": "attr_passive_growth",
        "target": "mag",
        "value": 0.2
      },
      {
        "type": "attr_passive_growth",
        "target": "spr",
        "value": 0.2
      },
      {
        "type": "attr_passive_growth",
        "target": "mny",
        "value": 0.2
      },
      {
        "type": "attr_passive_growth",
        "target": "luk",
        "value": 0.2
      }
    ],
    "acquireText": "获得 📖 编年史 — 所有属性每年额外成长+0.2（全能成长）"
  },
  {
    "id": "dark_mirror",
    "name": "暗黑之镜",
    "description": "一面永远映不出你面容的镜子。从里面传来的低语许诺着力量……",
    "icon": "🪞",
    "rarity": "legendary",
    "category": "special",
    "effects": [
      {
        "type": "skill_check_bonus",
        "value": 0.15,
        "condition": "attribute.spr >= 20"
      },
      {
        "type": "hp_cap_modifier",
        "value": -0.2
      },
      {
        "type": "attr_passive_growth",
        "target": "mag",
        "value": 0.5
      },
      {
        "type": "conditional_regen",
        "value": 15,
        "condition": "hp < 20"
      }
    ],
    "acquireText": "获得 🪞 暗黑之镜 — 灵魂≥20时判定+15%，魔力成长+0.5/年，但HP上限降低20%"
  },
  {
    "id": "reincarnation_memory",
    "name": "转生记忆",
    "description": "一道突然闪现的记忆——属于\"上辈子\"的知识碎片，模糊却真实。",
    "icon": "🧠",
    "rarity": "legendary",
    "category": "special",
    "effects": [
      {
        "type": "attr_passive_growth",
        "target": "int",
        "value": 0.5
      },
      {
        "type": "attr_passive_growth",
        "target": "mny",
        "value": 0.5
      },
      {
        "type": "skill_check_bonus",
        "value": 0.05
      }
    ],
    "acquireText": "获得 🧠 转生记忆 — 智慧/家境成长+0.5/年，判定+5%"
  }
]